Title of work,Artist or author display,Start Date,End Date,Date,Type of Item,Partner institutions,"Latitude,Longitude",Latitude,Longitude,Location name,Image (link),Record url,Subject 1,Subject 2,Subject 3,Subject 4,Subject 5,Subject 6,Additional Subjects,Additional Subjects,Additional Subjects,Additional Subjects,Additional Subjects,Additional Subjects,Additional Subjects,Additional Subjects,Additional Subjects,Additional Subjects,Additional Subjects,Additional Subjects,Additional Subjects,Additional Subjects,Additional Subjects,Additional Subjects
Ringling Bros. Lion Tableau Wagon,Sebastian Wagon Works,1880,1880,1880,,Circus World Museum,"38.89511,-77.03637",38.89511,-77.03637,North America United States of America,"https://content.wdl.org/iiif/10695,1,1/full/!1024,1024/0/default.jpg",https://www.wdl.org/en/item/10695/,The arts,fine & decorative arts,Architecture,Design & decoration,Recreational & performing arts,Public performances,Circus,Cole Brothers Circus,Great Forepaugh Show,Ringling Brothers,Wagons,,,,,,,,,,,
The First Folio of Shakespeare,"Shakespeare, William, 1564-1616,Droeshout, Martin, born 1601,Blount, Edward, flourished 1588-1632,Jaggard, Isaac, died 1627",1623,1623,1623,,Folger Shakespeare Library,"48.2084899949,16.3720799977",48.2084899949,16.3720799977,"Europe,Europe United Kingdom of Great Britain and Northern Ireland England","https://content.wdl.org/iiif/11290,1,1/full/!1024,1024/0/default.jpg",https://www.wdl.org/en/item/11290/,Literature & rhetoric,English and Old English (Anglo-Saxon) literatures,English drama,Drama,,,,,,,,,,,,,,,,,,
The Lincoln Bible,undefined,1853,1853,1853,,Library of Congress,"38.89511,-77.03637",38.89511,-77.03637,North America United States of America,"https://content.wdl.org/iiif/11358,1,1/full/!1024,1024/0/default.jpg",https://www.wdl.org/en/item/11358/,Religion,Bible,History & geography,History of North America,United States,"Lincoln, Abraham, 1809-1865","Obama, Barack, born 1961",,,,,,,,,,,,,,,
Comprehensive Mirror to Aid in Government,"Sima, Guang, 1019-1086",1127,1279,"1127,1279",,National Central Library,"39.9075,116.39723",39.9075,116.39723,East Asia China,"https://content.wdl.org/iiif/11381,1,1/full/!1024,1024/0/default.jpg",https://www.wdl.org/en/item/11381/,History & geography,History of Asia,Far East,China & adjacent areas,"China--History--Warring States, 403-221 B.C.",,,,,,,,,,,,,,,,,
New Records on the Travel Round the Globe,"Li, Gui, 1842-1903",1878,1878,1878,,National Central Library,"31.22222,121.45806",31.22222,121.45806,"East Asia China Shanghai,Europe France Île-de-France Paris,Europe United Kingdom of Great Britain and Northern Ireland England London,North America United States of America District of Columbia Washington,North America United States of America Massachusetts Boston,North America United States of America New York,North America United States of America Pennsylvania Philadelphia","https://content.wdl.org/iiif/11419,1,1/full/!1024,1024/0/default.jpg",https://www.wdl.org/en/item/11419/,History & geography,Geography & travel,"Centennial International Exhibition (1876 : Philadelphia, Pennsylvania)",Description and travel,Exhibitions and displays,Fairs,,,,,,,,,,,,,,,,
Guide to Astronomy,undefined,1790,1790,1790,,National Central Library,"39.9075,116.39723",39.9075,116.39723,East Asia China,"https://content.wdl.org/iiif/11430,1,1/full/!1024,1024/0/default.jpg",https://www.wdl.org/en/item/11430/,Philosophy & psychology,Parapsychology & occultism,Specific topics in parapsychology & occultism,Natural sciences & mathematics,Astronomy & allied sciences,Astrology,"Astronomy, Chinese",Constellations,Divination,Planets,,,,,,,,,,,,
Arabia: The Cradle of Islam,"Zwemer, Samuel Marinus, 1867-1952,Dennis, James S. (James Shepard), 1842-1914",1900,1900,1900,,Library of Congress,"30.0626299962,31.2496699957",30.0626299962,31.2496699957,Middle East and North Africa,"https://content.wdl.org/iiif/11757,1,1/full/!1024,1024/0/default.jpg",https://www.wdl.org/en/item/11757/,Religion,Other religions,"Islam, Babism & Bahai Faith",History & geography,Geography & travel,Geography of & travel in Asia,Arabian Peninsula,Arabic language,Arabic literature,Description and travel,Islam,Missionaries,Missions,"Muḥammad, Prophet, died 632",Politics and government,,,,,,,
"Arabia: Comprising Its Geography, History, and Topography","Conder, Josiah, 1789-1855",1833,1833,1833,,Library of Congress,"35.69439,51.42151",35.69439,51.42151,"Central and South Asia Iran, Islamic Republic of,Middle East and North Africa Bahrain,Middle East and North Africa Egypt,Middle East and North Africa Iraq,Middle East and North Africa Jordan,Middle East and North Africa Kuwait,Middle East and North Africa Oman,Middle East and North Africa Qatar,Middle East and North Africa Saudi Arabia,Middle East and North Africa Syrian Arab Republic,Middle East and North Africa United Arab Emirates,Middle East and North Africa Yemen","https://content.wdl.org/iiif/11761,1,1/full/!1024,1024/0/default.jpg",https://www.wdl.org/en/item/11761/,History & geography,Geography & travel,Geography of & travel in Asia,History of Asia,Far East,Arabian Peninsula & adjacent areas,Arabian Peninsula,Bible. Old Testament,Description and travel,Holy Roman Empire,Islam,"Muḥammad, Prophet, died 632",,,,,,,,,,
"Life in the Desert, or, Recollections of Travel in Asia and Africa","Dumas, Alexandre, 1802-1870,Lapeyrouce, M. Stanislaus de,Du Couret, Louis, 1812-1867?",1860,1860,1860,,Library of Congress,"15.33805,38.93184",15.33805,38.93184,"Africa Eritrea,Africa Ethiopia,Africa Somalia,Middle East and North Africa Bahrain,Middle East and North Africa Oman,Middle East and North Africa Qatar,Middle East and North Africa Saudi Arabia,Middle East and North Africa United Arab Emirates,Middle East and North Africa Yemen","https://content.wdl.org/iiif/11762,1,1/full/!1024,1024/0/default.jpg",https://www.wdl.org/en/item/11762/,History & geography,Geography & travel,Geography of & travel in Asia,History of Asia,Far East,Arabian Peninsula & adjacent areas,Arabian Peninsula,Arabian Peninsula--Social life and customs,Description and travel,,,,,,,,,,,,,
From the Indus to the Tigris,"Bellew, H. W. (Henry Walter), 1834-1892",1874,1874,1874,,Library of Congress,"34.52813,69.17233",34.52813,69.17233,"Central and South Asia Afghanistan,Central and South Asia India,Central and South Asia Iran, Islamic Republic of,Central and South Asia Pakistan,Middle East and North Africa Iraq","https://content.wdl.org/iiif/11793,1,1/full/!1024,1024/0/default.jpg",https://www.wdl.org/en/item/11793/,History & geography,Geography & travel,Geography of & travel in Asia,History of Asia,Far East,Central Asia,Brahui language,Description and travel,Economic conditions,Library of Congress Afghanistan Project,Manners and customs,Politics and government,,,,,,,,,,
"Narrative of a Journey into Khorasān, in the Years 1821 and 1822","Fraser, James Baillie, 1783-1856",1825,1825,1825,,Library of Congress,"34.52813,69.17233",34.52813,69.17233,"Central and South Asia Afghanistan,Central and South Asia Iran, Islamic Republic of","https://content.wdl.org/iiif/11797,1,1/full/!1024,1024/0/default.jpg",https://www.wdl.org/en/item/11797/,History & geography,Geography & travel,Geography of & travel in Asia,History of Asia,Far East,Central Asia,Description and travel,Economic conditions,Library of Congress Afghanistan Project,Manners and customs,Politics and government,,,,,,,,,,,
Taishokan,undefined,1600,1699,"1600,1699",,National Diet Library,"35.6895,139.69171",35.6895,139.69171,East Asia Japan,"https://content.wdl.org/iiif/11834,1,1/full/!1024,1024/0/default.jpg",https://www.wdl.org/en/item/11834/,Literature & rhetoric,Literatures of other specific languages and language families,Literatures of East & Southeast Asia,Folklore,"Fujiwara, Kamatari, 614-669",Japanese literature,"Mythology, Japanese",,,,,,,,,,,,,,,
Kiaochow and Weihaiwei,"Great Britain. Foreign Office. Historical Section,Prothero, G.W. (George Walter), 1848-1922",1920,1920,1920,,Library of Congress,"36.2838899956,120.003329983",36.2838899956,120.003329983,"East Asia China Shandong Province Jiaoxian,East Asia China Shandong Province Weihai","https://content.wdl.org/iiif/11880,1,1/full/!1024,1024/0/default.jpg",https://www.wdl.org/en/item/11880/,Social sciences,Political science,International relations,History & geography,History of Asia,Far East,China & adjacent areas,Description and travel,Economic relations,Foreign relations,Germany--Colonies,Great Britain--Colonies,Handbooks and manuals,Politics and government,Protectorates,Treaties,,,,,,
"History of Afghanistan, from the Earliest Period to the Outbreak of the War of 1878","Malleson, G. B. (George Bruce), 1825-1898",1879,1879,1879,,Library of Congress,"34.52813,69.17233",34.52813,69.17233,"Central and South Asia Afghanistan,Central and South Asia India,Europe Russian Federation,Europe United Kingdom of Great Britain and Northern Ireland","https://content.wdl.org/iiif/12883,1,1/full/!1024,1024/0/default.jpg",https://www.wdl.org/en/item/12883/,History & geography,History of Asia,Far East,Central Asia,Afghan Wars,Colonization,East India Company,Great Britain -- Foreign relations,Great Game (South Asia),Library of Congress Afghanistan Project,Military campaigns,Politics and government,,,,,,,,,,
"The Uganda Journal, Volume 20, Number 2, September 1956","Uganda Literary and Scientific Society,Uganda Society",1956,1956,1956,,National Library of Uganda,"0.31628,32.58219",0.31628,32.58219,Africa Uganda,"https://content.wdl.org/iiif/13818,1,1/full/!1024,1024/0/default.jpg",https://www.wdl.org/en/item/13818/,"Computer science, information, general works",General serial publications,Serials in English,History & geography,History of Africa,Central Africa & offshore islands,African languages,Agriculture,Archaeological sites,Archaeology,Expeditions and surveys,Fish,Grain,Historic sites,Indigenous peoples,Karamojong (African people),Missionaries,Missions,Swamps,Teso (African people),,
The Tale of Kiều,"Pelliot, Paul, 1878-1945,Nguyễn, Du, 1765-1820",1894,1894,1894,,The British Library,"21.0245,105.84117",21.0245,105.84117,Southeast Asia Viet Nam,"https://content.wdl.org/iiif/14287,1,1/full/!1024,1024/0/default.jpg",https://www.wdl.org/en/item/14287/,Literature & rhetoric,Literatures of other specific languages and language families,Literatures of East & Southeast Asia,Poetry,Vietnamese literature,Vietnamese poetry,,,,,,,,,,,,,,,,
A Compilation of Divinations from the Tianyuan Jade Calendar and the Big Dipper Scripture,"Fan, Shifu,Zhan, Bin",1368,1644,"1368,1644",,National Central Library,"39.9075,116.39723",39.9075,116.39723,East Asia China,"https://content.wdl.org/iiif/14404,1,1/full/!1024,1024/0/default.jpg",https://www.wdl.org/en/item/14404/,Philosophy & psychology,Parapsychology & occultism,Specific topics in parapsychology & occultism,History & geography,History of Asia,Far East,China & adjacent areas,"Astrology, Chinese","Calendar, Chinese",Calendars,Divination,Fu (Chinese poetry),Meteorology,Poetry,Weather,,,,,,,
"Cabool: A Personal Narrative of a Journey to, and Residence in that City, in the Years 1836, 7, and 8","Burnes, Alexander, Sir, 1805-1841",1843,1843,1843,,Library of Congress,"34.52813,69.17233",34.52813,69.17233,"Central and South Asia Afghanistan,Central and South Asia India,Central and South Asia Pakistan","https://content.wdl.org/iiif/14409,1,1/full/!1024,1024/0/default.jpg",https://www.wdl.org/en/item/14409/,History & geography,Geography & travel,Geography of & travel in Asia,History of Asia,Far East,Central Asia,"Burnes, Alexander, Sir, 1805-1841",Description and travel,Economic conditions,Ethnic groups,Expeditions and surveys,Indus River,Library of Congress Afghanistan Project,Manners and customs,,,,,,,,
"Life of Saint Margaret"" and Lives of Other Saints""",undefined,1060,1080,"1060,1080",,Bavarian State Library,"47.7062399949,11.4152199984",47.7062399949,11.4152199984,Europe Germany Bavaria Benediktbeuern,"https://content.wdl.org/iiif/14696,1,1/full/!1024,1024/0/default.jpg",https://www.wdl.org/en/item/14696/,Religion,Christian moral & devotional theology,Devotional literature,History of Christianity & Christian church,Biography,Christian hagiography,Illuminations,"Margaret, of Antioch, Saint",Saints,,,,,,,,,,,,,
"Of the Nature of Things"" and ""Of the Times"" by Bede. Letters by Saint Jerome and Pseudo-Jerome. Allegorical Drawings with Commentary and Glosses""","Bede, the Venerable, Saint, 673-735,Jerome, Saint, died 419 or 420,Pseudo-Jerome",1025,1099,"1025,1099",,Bavarian State Library,"47.7122999949,11.7581999984",47.7122999949,11.7581999984,Europe Germany Bavaria Tegernsee,"https://content.wdl.org/iiif/14709,1,1/full/!1024,1024/0/default.jpg",https://www.wdl.org/en/item/14709/,Philosophy & psychology,Metaphysics,Cosmology,Religion,Christian moral & devotional theology,Christian ethics,Calendars,Christianity -- Philosophy,Chronology,Ethics,Fantasy in art,Monsters,Timekeeping,,,,,,,,,
"One Hundred Aspects of the Moon: The Village of the Shi Clan on a Moonlit Night - Nine-Dragon Tattoo from The Water Margin""""","Tsukioka, Yoshitoshi, 1839-1892,Yamamoto",1885,1885,1885,,National Diet Library,"39.9075,116.39723",39.9075,116.39723,"East Asia China,East Asia Japan","https://content.wdl.org/iiif/5210,1,1/full/!1024,1024/0/default.jpg",https://www.wdl.org/en/item/15210/,The arts,fine & decorative arts,Graphic arts,printmaking & prints,History & geography,History of Asia,Far East,Japan,"Art, Japanese",Chinese literature,Moon,Tattooing,Ukiyo-e,Willows,Woodcuts,,,,,,,
Collected Literary Works of Ouyang Xingzhou,"Ouyang, Zhan, 798-approximately 827",1127,1279,"1127,1279",,National Central Library,"30.4999999962,102.499999986",30.4999999962,102.499999986,East Asia China Sichuan Province,"https://content.wdl.org/iiif/15575,1,1/full/!1024,1024/0/default.jpg",https://www.wdl.org/en/item/15575/,Literature & rhetoric,Literatures of other specific languages and language families,Literatures of East & Southeast Asia,History & geography,History of Asia,Far East,China & adjacent areas,Chinese literature,Chinese poetry,Ci (Chinese poetry),Fu (Chinese poetry),Poetry,,,,,,,,,,
"Bengal Hurkaru. Volume 11, Number 560, Tuesday, October 8, 1805","Greenway, Joseph",1805,1805,1805,,Library of Congress,"23.7104,90.40744",23.7104,90.40744,"Central and South Asia Bangladesh,Central and South Asia India West Bengal","https://content.wdl.org/iiif/16093,1,1/full/!1024,1024/0/default.jpg",https://www.wdl.org/en/item/16093/,"Computer science, information, general works","Documentary media, educational media, news media",journalism,publishing,Newspapers in other geographic areas,History & geography,History of Asia,Far East,South Asia,India,Advertising,"Dundas, Henry, 1742-1811",East India Company,"India -- History -- British occupation, 1765-1947",Political corruption,Social matters,,,,,,
"Bengal Hurkaru. Volume 11, Number 564, Tuesday, November 5, 1805","Greenway, Joseph",1805,1805,1805,,Library of Congress,"23.7104,90.40744",23.7104,90.40744,"Central and South Asia Bangladesh,Central and South Asia India West Bengal","https://content.wdl.org/iiif/16097,1,1/full/!1024,1024/0/default.jpg",https://www.wdl.org/en/item/16097/,"Computer science, information, general works","Documentary media, educational media, news media",journalism,publishing,Newspapers in other geographic areas,History & geography,History of Asia,Far East,South Asia,India,Advertising,East India Company,"India -- History -- British occupation, 1765-1947","Napoleonic Wars, 1800-1815",Social matters,,,,,,,
"Bengal Hurkaru. Volume 11, Number 571, Tuesday, December 24, 1805","Greenway, Joseph",1805,1805,1805,,Library of Congress,"23.7104,90.40744",23.7104,90.40744,"Central and South Asia Bangladesh,Central and South Asia India West Bengal","https://content.wdl.org/iiif/16104,1,1/full/!1024,1024/0/default.jpg",https://www.wdl.org/en/item/16104/,"Computer science, information, general works","Documentary media, educational media, news media",journalism,publishing,Newspapers in other geographic areas,History & geography,History of Asia,Far East,South Asia,India,Advertising,"Cornwallis, Charles Cornwallis, Marquis, 1738-1805",East India Company,"India -- History -- British occupation, 1765-1947",Social matters,,,,,,,
"Bengal Hurkaru and Chronicle. Volume 2, Number 3, Thursday, July 3, 1828",undefined,1828,1828,1828,,Library of Congress,"23.7104,90.40744",23.7104,90.40744,"Central and South Asia Bangladesh,Central and South Asia India West Bengal","https://content.wdl.org/iiif/16147,1,1/full/!1024,1024/0/default.jpg",https://www.wdl.org/en/item/16147/,"Computer science, information, general works","Documentary media, educational media, news media",journalism,publishing,Newspapers in other geographic areas,History & geography,History of Asia,Far East,South Asia,India,East India Company,"India -- History -- British occupation, 1765-1948",Social matters,,,,,,,,,
Thousand and One Nights. Now First Completely Done into English Prose and Verse,"Villon Society (London, England),Macnaghten, W. H. (William Hay), Sir, 1793-1841,Payne, John, 1842-1916",1882,1884,"1882,1884",,Qatar National Library,"26.21536,50.5832",26.21536,50.5832,"Middle East and North Africa Bahrain,Middle East and North Africa Iraq,Middle East and North Africa Oman,Middle East and North Africa Qatar,Middle East and North Africa Saudi Arabia,Middle East and North Africa United Arab Emirates,Middle East and North Africa Yemen","https://content.wdl.org/iiif/16199,1,1/full/!1024,1024/0/default.jpg",https://www.wdl.org/en/item/16199/,Literature & rhetoric,Literatures of other specific languages and language families,Afro-Asiatic literatures,Semitic literatures,History & geography,History of Asia,Far East,Arabian Peninsula & adjacent areas,Adventure stories,Arabian Peninsula,Arabian Peninsula--Social life and customs,Arabic literature,Arabs,Folklore,,,,,,,,
Through the Heart of Afghanistan,"Trinkler, Emil, 1896-1931,Featherstone, B. K. (Belford Kinchant), born 1898",1928,1928,1928,,Library of Congress,"34.4999999958,61.9999999914",34.4999999958,61.9999999914,"Central and South Asia Afghanistan Herāt Herat,Central and South Asia Afghanistan Kābul Kābul,Central and South Asia Pakistan Northwest Frontier Peshāwar,Europe Latvia Rīga","https://content.wdl.org/iiif/16715,1,1/full/!1024,1024/0/default.jpg",https://www.wdl.org/en/item/16715/,History & geography,Geography & travel,Geography of & travel in Asia,Description and travel,Exploration and encounters,Foreign relations,Library of Congress Afghanistan Project,,,,,,,,,,,,,,,
"The Face of Manchuria, Korea, and Russian Turkestan","Kemp, E. G. (Emily Georgiana), 1860-1939",1910,1910,1910,,Library of Congress,"43.2565399951,76.9284799893",43.2565399951,76.9284799893,"Central and South Asia Kazakhstan Almaty Almaty,Central and South Asia Kazakhstan Jambyl,Central and South Asia Kazakhstan Kzyl-Orda,Central and South Asia Kazakhstan Ongtüstik Qazaqstan oblysy,Central and South Asia Kyrgyzstan,Central and South Asia Tajikistan,Central and South Asia Turkmenistan,Central and South Asia Uzbekistan,East Asia China Heilongjiang,East Asia China Inner Mongolia,East Asia China Jilin,East Asia China Liaoning Province,East Asia Democratic People's Republic of Korea,East Asia Republic of Korea","https://content.wdl.org/iiif/16719,1,1/full/!1024,1024/0/default.jpg",https://www.wdl.org/en/item/16719/,History & geography,Geography & travel,Geography of & travel in Asia,History of Asia,Far East,China & adjacent areas,Cities and towns,Description and travel,Exploration and encounters,Islam,Library of Congress Afghanistan Project,Manners and customs,Trans-Siberian Railroad,,,,,,,,,
Russian Central Asia,"Lansdell, Henry, 1841-1919",1885,1885,1885,,Library of Congress,"50.4267499948,80.2666899888",50.4267499948,80.2666899888,"Central and South Asia Kazakhstan East Kazakhstan Region Semey,Central and South Asia Turkmenistan Mary,Central and South Asia Uzbekistan Buxoro Viloyati Bukhara,Central and South Asia Uzbekistan Farg'ona Viloyati Kokand,Central and South Asia Uzbekistan Qashqadaryo Viloyati Qarshi,Central and South Asia Uzbekistan Samarqand Viloyati Samarkand,Central and South Asia Uzbekistan Toshkent Viloyati Tashkent,Central and South Asia Uzbekistan Xorazm Viloyati Khiva,East Asia China Xinjiang Uyghur Autonomous Region Yining","https://content.wdl.org/iiif/16720,1,1/full/!1024,1024/0/default.jpg",https://www.wdl.org/en/item/16720/,History & geography,Geography & travel,Geography of & travel in Asia,History of Asia,Far East,Central Asia,Asiatic Russia,Bible. Old Testament,Description and travel,Exploration and encounters,Library of Congress Afghanistan Project,Manners and customs,Religious education,,,,,,,,,
"Through Persia in Disguise, with Reminiscences of the Indian Mutiny","Stewart, Charles Edward, 1836-1904,Stewart, Anne Nairne,Stewart, Basil, born 1880",1911,1911,1911,,Library of Congress,"34.52813,69.17233",34.52813,69.17233,"Central and South Asia Afghanistan,Central and South Asia Bangladesh,Central and South Asia Bhutan,Central and South Asia India,Central and South Asia Iran, Islamic Republic of,Central and South Asia Pakistan,Central and South Asia Sri Lanka,Europe United Kingdom of Great Britain and Northern Ireland,Southeast Asia Myanmar","https://content.wdl.org/iiif/16721,1,1/full/!1024,1024/0/default.jpg",https://www.wdl.org/en/item/16721/,Social sciences,Political science,International relations,History & geography,Geography & travel,Geography of & travel in Asia,Afghan Boundary Commission,Colonization,Description and travel,Diplomats,Espionage,Great Britain. Army. British Indian Army,Great Game (South Asia),"India -- History -- Sepoy Rebellion, 1857-1858",Intelligence service,Library of Congress Afghanistan Project,"Lumsden, Peter Stark, Sir, 1829-1918",Military campaigns,Missionaries,Railroads,Spies,"Stewart, Charles Edward, 1836-1904"
Tales of Travel,"Curzon of Kedleston, George Nathaniel Curzon, Marquess, 1859-1925",1923,1923,1923,,Library of Congress,"-8.83682,13.23432",-8.83682,13.23432,"Africa Angola,Africa Malawi,Africa Zambia Southern (Zambia) Livingstone,Africa Zimbabwe,Central and South Asia Afghanistan Badakhshān Sarḩad,Central and South Asia Afghanistan Kābul Kābul,Central and South Asia India Madhya Pradesh Datia,Central and South Asia India Uttar Pradesh Lucknow,Central and South Asia Iran, Islamic Republic of Tehrān Tehrān,Central and South Asia Pakistan Gilgit-Baltistan Bunji,East Asia Japan,Europe United Kingdom of Great Britain and Northern Ireland Saint Helena Jamestown,Latin America and the Caribbean Argentina Misiones Puerto Iguazú,Latin America and the Caribbean Guyana Potaro-Siparuni,Middle East and North Africa Egypt Qinā Qinā,Middle East and North Africa Iraq An-Najaf Najaf,Middle East and North Africa Iraq Babil Al Ḩillah,Middle East and North Africa Kuwait,Middle East and North Africa Tunisia al-Qayrawān,Oceania and the Pacific New Zealand","https://content.wdl.org/iiif/16723,1,1/full/!1024,1024/0/default.jpg",https://www.wdl.org/en/item/16723/,History & geography,Geography & travel,History of Asia,Far East,Central Asia,"Curzon of Kedleston, George Nathaniel Curzon, Marquess, 1859-1925",Description and travel,Deserts,Kings and rulers,"Lawrence, Henry Montgomery, Sir, 1806-1857","Li, Hongzhang, 1823-1901",Library of Congress Afghanistan Project,Manners and customs,"Napoleon I, Emperor of the French, 1769-1821",Voyages and travels,Waterfalls,"ʻAbd al-Raḥmān Khān, Amir of Afghanistan, 1844-1901",,,,,
Central Asian Questions,"Boulger, Demetrius Charles, 1853-1928",1885,1885,1885,,Library of Congress,"34.52813,69.17233",34.52813,69.17233,"Central and South Asia Afghanistan,East Asia China,Europe Russian Federation,Europe United Kingdom of Great Britain and Northern Ireland","https://content.wdl.org/iiif/16728,1,1/full/!1024,1024/0/default.jpg",https://www.wdl.org/en/item/16728/,Social sciences,Political science,International migration & colonization,History & geography,Geography & travel,Geography of & travel in Asia,Colonization,Eastern question (Central Asia),Foreign relations,Great Game (South Asia),Library of Congress Afghanistan Project,,,,,,,,,,,
